{
  "id": "day1-match07",
  "day": 2,
  "matchNumber": 7,
  "round": "Group A Second Stage",
  "teams": [
    "umazing-hotspring",
    "falena",
    "umalliance"
  ],
  "activeCategory": "sprint",
  "races": {
    "sprint": [
      {
        "teamId": "umazing-hotspring",
        "slot": 0,
        "gate": null
      },
      {
        "teamId": "umazing-hotspring",
        "slot": 1,
        "gate": null
      },
      {
        "teamId": "umazing-hotspring",
        "slot": 2,
        "gate": null
      },
      {
        "teamId": "falena",
        "slot": 0,
        "gate": null
      },
      {
        "teamId": "falena",
        "slot": 1,
        "gate": null
      },
      {
        "teamId": "falena",
        "slot": 2,
        "gate": null
      },
      {
        "teamId": "umalliance",
        "slot": 0,
        "gate": null
      },
      {
        "teamId": "umalliance",
        "slot": 1,
        "gate": null
      },
      {
        "teamId": "umalliance",
        "slot": 2,
        "gate": null
      }
    ],
    "mile": [
      {
        "teamId": "umazing-hotspring",
        "slot": 0,
        "gate": null
      },
      {
        "teamId": "umazing-hotspring",
        "slot": 1,
        "gate": null
      },
      {
        "teamId": "umazing-hotspring",
        "slot": 2,
        "gate": null
      },
      {
        "teamId": "falena",
        "slot": 0,
        "gate": null
      },
      {
        "teamId": "falena",
        "slot": 1,
        "gate": null
      },
      {
        "teamId": "falena",
        "slot": 2,
        "gate": null
      },
      {
        "teamId": "umalliance",
        "slot": 0,
        "gate": null
      },
      {
        "teamId": "umalliance",
        "slot": 1,
        "gate": null
      },
      {
        "teamId": "umalliance",
        "slot": 2,
        "gate": null
      }
    ],
    "medium": [
      {
        "teamId": "umazing-hotspring",
        "slot": 0,
        "gate": null
      },
      {
        "teamId": "umazing-hotspring",
        "slot": 1,
        "gate": null
      },
      {
        "teamId": "umazing-hotspring",
        "slot": 2,
        "gate": null
      },
      {
        "teamId": "falena",
        "slot": 0,
        "gate": null
      },
      {
        "teamId": "falena",
        "slot": 1,
        "gate": null
      },
      {
        "teamId": "falena",
        "slot": 2,
        "gate": null
      },
      {
        "teamId": "umalliance",
        "slot": 0,
        "gate": null
      },
      {
        "teamId": "umalliance",
        "slot": 1,
        "gate": null
      },
      {
        "teamId": "umalliance",
        "slot": 2,
        "gate": null
      }
    ],
    "long": [
      {
        "teamId": "umazing-hotspring",
        "slot": 0,
        "gate": null
      },
      {
        "teamId": "umazing-hotspring",
        "slot": 1,
        "gate": null
      },
      {
        "teamId": "umazing-hotspring",
        "slot": 2,
        "gate": null
      },
      {
        "teamId": "falena",
        "slot": 0,
        "gate": null
      },
      {
        "teamId": "falena",
        "slot": 1,
        "gate": null
      },
      {
        "teamId": "falena",
        "slot": 2,
        "gate": null
      },
      {
        "teamId": "umalliance",
        "slot": 0,
        "gate": null
      },
      {
        "teamId": "umalliance",
        "slot": 1,
        "gate": null
      },
      {
        "teamId": "umalliance",
        "slot": 2,
        "gate": null
      }
    ],
    "dirt": [
      {
        "teamId": "umazing-hotspring",
        "slot": 0,
        "gate": null
      },
      {
        "teamId": "umazing-hotspring",
        "slot": 1,
        "gate": null
      },
      {
        "teamId": "umazing-hotspring",
        "slot": 2,
        "gate": null
      },
      {
        "teamId": "falena",
        "slot": 0,
        "gate": null
      },
      {
        "teamId": "falena",
        "slot": 1,
        "gate": null
      },
      {
        "teamId": "falena",
        "slot": 2,
        "gate": null
      },
      {
        "teamId": "umalliance",
        "slot": 0,
        "gate": null
      },
      {
        "teamId": "umalliance",
        "slot": 1,
        "gate": null
      },
      {
        "teamId": "umalliance",
        "slot": 2,
        "gate": null
      }
    ]
  }
}
