{
  "id": "day1-match08",
  "day": 2,
  "matchNumber": 8,
  "round": "Group B Second Stage",
  "teams": [
    "the-shadow-clones",
    "rilliance",
    "cabal"
  ],
  "activeCategory": "long",
  "races": {
    "sprint": [
      {
        "teamId": "the-shadow-clones",
        "slot": 0,
        "gate": 1
      },
      {
        "teamId": "the-shadow-clones",
        "slot": 1,
        "gate": 9
      },
      {
        "teamId": "the-shadow-clones",
        "slot": 2,
        "gate": 5
      },
      {
        "teamId": "rilliance",
        "slot": 0,
        "gate": 2
      },
      {
        "teamId": "rilliance",
        "slot": 1,
        "gate": 8
      },
      {
        "teamId": "rilliance",
        "slot": 2,
        "gate": 7
      },
      {
        "teamId": "cabal",
        "slot": 0,
        "gate": 4
      },
      {
        "teamId": "cabal",
        "slot": 1,
        "gate": 3
      },
      {
        "teamId": "cabal",
        "slot": 2,
        "gate": 6
      }
    ],
    "mile": [
      {
        "teamId": "the-shadow-clones",
        "slot": 0,
        "gate": 1
      },
      {
        "teamId": "the-shadow-clones",
        "slot": 1,
        "gate": 5
      },
      {
        "teamId": "the-shadow-clones",
        "slot": 2,
        "gate": 6
      },
      {
        "teamId": "rilliance",
        "slot": 0,
        "gate": 4
      },
      {
        "teamId": "rilliance",
        "slot": 1,
        "gate": 7
      },
      {
        "teamId": "rilliance",
        "slot": 2,
        "gate": 2
      },
      {
        "teamId": "cabal",
        "slot": 0,
        "gate": 8
      },
      {
        "teamId": "cabal",
        "slot": 1,
        "gate": 9
      },
      {
        "teamId": "cabal",
        "slot": 2,
        "gate": 3
      }
    ],
    "medium": [
      {
        "teamId": "the-shadow-clones",
        "slot": 0,
        "gate": 9
      },
      {
        "teamId": "the-shadow-clones",
        "slot": 1,
        "gate": 1
      },
      {
        "teamId": "the-shadow-clones",
        "slot": 2,
        "gate": 3
      },
      {
        "teamId": "rilliance",
        "slot": 0,
        "gate": 4
      },
      {
        "teamId": "rilliance",
        "slot": 1,
        "gate": 8
      },
      {
        "teamId": "rilliance",
        "slot": 2,
        "gate": 6
      },
      {
        "teamId": "cabal",
        "slot": 0,
        "gate": 7
      },
      {
        "teamId": "cabal",
        "slot": 1,
        "gate": 2
      },
      {
        "teamId": "cabal",
        "slot": 2,
        "gate": 5
      }
    ],
    "long": [
      {
        "teamId": "the-shadow-clones",
        "slot": 0,
        "gate": null
      },
      {
        "teamId": "the-shadow-clones",
        "slot": 1,
        "gate": null
      },
      {
        "teamId": "the-shadow-clones",
        "slot": 2,
        "gate": null
      },
      {
        "teamId": "rilliance",
        "slot": 0,
        "gate": null
      },
      {
        "teamId": "rilliance",
        "slot": 1,
        "gate": null
      },
      {
        "teamId": "rilliance",
        "slot": 2,
        "gate": null
      },
      {
        "teamId": "cabal",
        "slot": 0,
        "gate": null
      },
      {
        "teamId": "cabal",
        "slot": 1,
        "gate": null
      },
      {
        "teamId": "cabal",
        "slot": 2,
        "gate": null
      }
    ],
    "dirt": [
      {
        "teamId": "the-shadow-clones",
        "slot": 0,
        "gate": null
      },
      {
        "teamId": "the-shadow-clones",
        "slot": 1,
        "gate": null
      },
      {
        "teamId": "the-shadow-clones",
        "slot": 2,
        "gate": null
      },
      {
        "teamId": "rilliance",
        "slot": 0,
        "gate": null
      },
      {
        "teamId": "rilliance",
        "slot": 1,
        "gate": null
      },
      {
        "teamId": "rilliance",
        "slot": 2,
        "gate": null
      },
      {
        "teamId": "cabal",
        "slot": 0,
        "gate": null
      },
      {
        "teamId": "cabal",
        "slot": 1,
        "gate": null
      },
      {
        "teamId": "cabal",
        "slot": 2,
        "gate": null
      }
    ]
  }
}
