{
  "id": "day1-match11",
  "day": 21,
  "matchNumber": 11,
  "round": "Lower Finals",
  "teams": [
    "umamusuko",
    "king",
    ""
  ],
  "activeCategory": "mile",
  "races": {
    "sprint": [
      {
        "teamId": "umamusuko",
        "slot": 0,
        "gate": 2
      },
      {
        "teamId": "umamusuko",
        "slot": 1,
        "gate": 4
      },
      {
        "teamId": "umamusuko",
        "slot": 2,
        "gate": 8
      },
      {
        "teamId": "king",
        "slot": 0,
        "gate": 6
      },
      {
        "teamId": "king",
        "slot": 1,
        "gate": 3
      },
      {
        "teamId": "king",
        "slot": 2,
        "gate": 9
      },
      {
        "teamId": "",
        "slot": 0,
        "gate": null
      },
      {
        "teamId": "",
        "slot": 1,
        "gate": null
      },
      {
        "teamId": "",
        "slot": 2,
        "gate": null
      }
    ],
    "mile": [
      {
        "teamId": "umamusuko",
        "slot": 0,
        "gate": null
      },
      {
        "teamId": "umamusuko",
        "slot": 1,
        "gate": null
      },
      {
        "teamId": "umamusuko",
        "slot": 2,
        "gate": null
      },
      {
        "teamId": "king",
        "slot": 0,
        "gate": null
      },
      {
        "teamId": "king",
        "slot": 1,
        "gate": null
      },
      {
        "teamId": "king",
        "slot": 2,
        "gate": null
      },
      {
        "teamId": "",
        "slot": 0,
        "gate": null
      },
      {
        "teamId": "",
        "slot": 1,
        "gate": null
      },
      {
        "teamId": "",
        "slot": 2,
        "gate": null
      }
    ],
    "medium": [
      {
        "teamId": "umamusuko",
        "slot": 0,
        "gate": null
      },
      {
        "teamId": "umamusuko",
        "slot": 1,
        "gate": null
      },
      {
        "teamId": "umamusuko",
        "slot": 2,
        "gate": null
      },
      {
        "teamId": "king",
        "slot": 0,
        "gate": null
      },
      {
        "teamId": "king",
        "slot": 1,
        "gate": null
      },
      {
        "teamId": "king",
        "slot": 2,
        "gate": null
      },
      {
        "teamId": "",
        "slot": 0,
        "gate": null
      },
      {
        "teamId": "",
        "slot": 1,
        "gate": null
      },
      {
        "teamId": "",
        "slot": 2,
        "gate": null
      }
    ],
    "long": [
      {
        "teamId": "umamusuko",
        "slot": 0,
        "gate": null
      },
      {
        "teamId": "umamusuko",
        "slot": 1,
        "gate": null
      },
      {
        "teamId": "umamusuko",
        "slot": 2,
        "gate": null
      },
      {
        "teamId": "king",
        "slot": 0,
        "gate": null
      },
      {
        "teamId": "king",
        "slot": 1,
        "gate": null
      },
      {
        "teamId": "king",
        "slot": 2,
        "gate": null
      },
      {
        "teamId": "",
        "slot": 0,
        "gate": null
      },
      {
        "teamId": "",
        "slot": 1,
        "gate": null
      },
      {
        "teamId": "",
        "slot": 2,
        "gate": null
      }
    ],
    "dirt": [
      {
        "teamId": "umamusuko",
        "slot": 0,
        "gate": null
      },
      {
        "teamId": "umamusuko",
        "slot": 1,
        "gate": null
      },
      {
        "teamId": "umamusuko",
        "slot": 2,
        "gate": null
      },
      {
        "teamId": "king",
        "slot": 0,
        "gate": null
      },
      {
        "teamId": "king",
        "slot": 1,
        "gate": null
      },
      {
        "teamId": "king",
        "slot": 2,
        "gate": null
      },
      {
        "teamId": "",
        "slot": 0,
        "gate": null
      },
      {
        "teamId": "",
        "slot": 1,
        "gate": null
      },
      {
        "teamId": "",
        "slot": 2,
        "gate": null
      }
    ]
  }
}
