{
  "id": "day1-match04",
  "day": 1,
  "matchNumber": 4,
  "round": "Group B Match 2",
  "teams": [
    "rilliance",
    "kita-trauma",
    "uma-love"
  ],
  "activeCategory": "dirt",
  "races": {
    "sprint": [
      {
        "teamId": "rilliance",
        "slot": 0,
        "gate": 2
      },
      {
        "teamId": "rilliance",
        "slot": 1,
        "gate": 1
      },
      {
        "teamId": "rilliance",
        "slot": 2,
        "gate": 6
      },
      {
        "teamId": "kita-trauma",
        "slot": 0,
        "gate": 9
      },
      {
        "teamId": "kita-trauma",
        "slot": 1,
        "gate": 5
      },
      {
        "teamId": "kita-trauma",
        "slot": 2,
        "gate": 3
      },
      {
        "teamId": "uma-love",
        "slot": 0,
        "gate": 4
      },
      {
        "teamId": "uma-love",
        "slot": 1,
        "gate": 8
      },
      {
        "teamId": "uma-love",
        "slot": 2,
        "gate": 7
      }
    ],
    "mile": [
      {
        "teamId": "rilliance",
        "slot": 0,
        "gate": 5
      },
      {
        "teamId": "rilliance",
        "slot": 1,
        "gate": 9
      },
      {
        "teamId": "rilliance",
        "slot": 2,
        "gate": 7
      },
      {
        "teamId": "kita-trauma",
        "slot": 0,
        "gate": 8
      },
      {
        "teamId": "kita-trauma",
        "slot": 1,
        "gate": 6
      },
      {
        "teamId": "kita-trauma",
        "slot": 2,
        "gate": 2
      },
      {
        "teamId": "uma-love",
        "slot": 0,
        "gate": 3
      },
      {
        "teamId": "uma-love",
        "slot": 1,
        "gate": 4
      },
      {
        "teamId": "uma-love",
        "slot": 2,
        "gate": 1
      }
    ],
    "medium": [
      {
        "teamId": "rilliance",
        "slot": 0,
        "gate": 4
      },
      {
        "teamId": "rilliance",
        "slot": 1,
        "gate": 1
      },
      {
        "teamId": "rilliance",
        "slot": 2,
        "gate": 3
      },
      {
        "teamId": "kita-trauma",
        "slot": 0,
        "gate": 2
      },
      {
        "teamId": "kita-trauma",
        "slot": 1,
        "gate": 9
      },
      {
        "teamId": "kita-trauma",
        "slot": 2,
        "gate": 5
      },
      {
        "teamId": "uma-love",
        "slot": 0,
        "gate": 8
      },
      {
        "teamId": "uma-love",
        "slot": 1,
        "gate": 6
      },
      {
        "teamId": "uma-love",
        "slot": 2,
        "gate": 7
      }
    ],
    "long": [
      {
        "teamId": "rilliance",
        "slot": 0,
        "gate": 6
      },
      {
        "teamId": "rilliance",
        "slot": 1,
        "gate": 5
      },
      {
        "teamId": "rilliance",
        "slot": 2,
        "gate": 4
      },
      {
        "teamId": "kita-trauma",
        "slot": 0,
        "gate": 3
      },
      {
        "teamId": "kita-trauma",
        "slot": 1,
        "gate": 2
      },
      {
        "teamId": "kita-trauma",
        "slot": 2,
        "gate": 9
      },
      {
        "teamId": "uma-love",
        "slot": 0,
        "gate": 7
      },
      {
        "teamId": "uma-love",
        "slot": 1,
        "gate": 1
      },
      {
        "teamId": "uma-love",
        "slot": 2,
        "gate": 8
      }
    ],
    "dirt": [
      {
        "teamId": "rilliance",
        "slot": 0,
        "gate": 1
      },
      {
        "teamId": "rilliance",
        "slot": 1,
        "gate": 9
      },
      {
        "teamId": "rilliance",
        "slot": 2,
        "gate": 8
      },
      {
        "teamId": "kita-trauma",
        "slot": 0,
        "gate": 7
      },
      {
        "teamId": "kita-trauma",
        "slot": 1,
        "gate": 4
      },
      {
        "teamId": "kita-trauma",
        "slot": 2,
        "gate": 3
      },
      {
        "teamId": "uma-love",
        "slot": 0,
        "gate": 2
      },
      {
        "teamId": "uma-love",
        "slot": 1,
        "gate": 5
      },
      {
        "teamId": "uma-love",
        "slot": 2,
        "gate": 6
      }
    ]
  }
}
