{
  "id": "day1-match10",
  "day": 2,
  "matchNumber": 10,
  "round": "Group B Semi",
  "teams": [
    "king",
    "kita-trauma",
    "cabal"
  ],
  "activeCategory": "dirt",
  "races": {
    "sprint": [
      {
        "teamId": "king",
        "slot": 0,
        "gate": 2
      },
      {
        "teamId": "king",
        "slot": 1,
        "gate": 7
      },
      {
        "teamId": "king",
        "slot": 2,
        "gate": 1
      },
      {
        "teamId": "kita-trauma",
        "slot": 0,
        "gate": 4
      },
      {
        "teamId": "kita-trauma",
        "slot": 1,
        "gate": 5
      },
      {
        "teamId": "kita-trauma",
        "slot": 2,
        "gate": 6
      },
      {
        "teamId": "cabal",
        "slot": 0,
        "gate": 9
      },
      {
        "teamId": "cabal",
        "slot": 1,
        "gate": 3
      },
      {
        "teamId": "cabal",
        "slot": 2,
        "gate": 8
      }
    ],
    "mile": [
      {
        "teamId": "king",
        "slot": 0,
        "gate": 4
      },
      {
        "teamId": "king",
        "slot": 1,
        "gate": 7
      },
      {
        "teamId": "king",
        "slot": 2,
        "gate": 6
      },
      {
        "teamId": "kita-trauma",
        "slot": 0,
        "gate": 5
      },
      {
        "teamId": "kita-trauma",
        "slot": 1,
        "gate": 9
      },
      {
        "teamId": "kita-trauma",
        "slot": 2,
        "gate": 8
      },
      {
        "teamId": "cabal",
        "slot": 0,
        "gate": 2
      },
      {
        "teamId": "cabal",
        "slot": 1,
        "gate": 3
      },
      {
        "teamId": "cabal",
        "slot": 2,
        "gate": 1
      }
    ],
    "medium": [
      {
        "teamId": "king",
        "slot": 0,
        "gate": 3
      },
      {
        "teamId": "king",
        "slot": 1,
        "gate": 7
      },
      {
        "teamId": "king",
        "slot": 2,
        "gate": 6
      },
      {
        "teamId": "kita-trauma",
        "slot": 0,
        "gate": 1
      },
      {
        "teamId": "kita-trauma",
        "slot": 1,
        "gate": 4
      },
      {
        "teamId": "kita-trauma",
        "slot": 2,
        "gate": 2
      },
      {
        "teamId": "cabal",
        "slot": 0,
        "gate": 8
      },
      {
        "teamId": "cabal",
        "slot": 1,
        "gate": 5
      },
      {
        "teamId": "cabal",
        "slot": 2,
        "gate": 9
      }
    ],
    "long": [
      {
        "teamId": "king",
        "slot": 0,
        "gate": 7
      },
      {
        "teamId": "king",
        "slot": 1,
        "gate": 3
      },
      {
        "teamId": "king",
        "slot": 2,
        "gate": 8
      },
      {
        "teamId": "kita-trauma",
        "slot": 0,
        "gate": 5
      },
      {
        "teamId": "kita-trauma",
        "slot": 1,
        "gate": 4
      },
      {
        "teamId": "kita-trauma",
        "slot": 2,
        "gate": 1
      },
      {
        "teamId": "cabal",
        "slot": 0,
        "gate": 6
      },
      {
        "teamId": "cabal",
        "slot": 1,
        "gate": 2
      },
      {
        "teamId": "cabal",
        "slot": 2,
        "gate": 9
      }
    ],
    "dirt": [
      {
        "teamId": "king",
        "slot": 0,
        "gate": 6
      },
      {
        "teamId": "king",
        "slot": 1,
        "gate": 5
      },
      {
        "teamId": "king",
        "slot": 2,
        "gate": 9
      },
      {
        "teamId": "kita-trauma",
        "slot": 0,
        "gate": 8
      },
      {
        "teamId": "kita-trauma",
        "slot": 1,
        "gate": 2
      },
      {
        "teamId": "kita-trauma",
        "slot": 2,
        "gate": 7
      },
      {
        "teamId": "cabal",
        "slot": 0,
        "gate": 1
      },
      {
        "teamId": "cabal",
        "slot": 1,
        "gate": 3
      },
      {
        "teamId": "cabal",
        "slot": 2,
        "gate": 4
      }
    ]
  }
}
