{
  "id": "day1-match06",
  "day": 1,
  "matchNumber": 6,
  "round": "Group B Middle 3 (MIDDLE)",
  "teams": [
    "",
    "",
    ""
  ],
  "activeCategory": "sprint",
  "races": {
    "sprint": [
      {
        "teamId": "",
        "slot": 0,
        "gate": null
      },
      {
        "teamId": "",
        "slot": 1,
        "gate": null
      },
      {
        "teamId": "",
        "slot": 2,
        "gate": null
      },
      {
        "teamId": "",
        "slot": 0,
        "gate": null
      },
      {
        "teamId": "",
        "slot": 1,
        "gate": null
      },
      {
        "teamId": "",
        "slot": 2,
        "gate": null
      },
      {
        "teamId": "",
        "slot": 0,
        "gate": null
      },
      {
        "teamId": "",
        "slot": 1,
        "gate": null
      },
      {
        "teamId": "",
        "slot": 2,
        "gate": null
      }
    ],
    "mile": [
      {
        "teamId": "",
        "slot": 0,
        "gate": null
      },
      {
        "teamId": "",
        "slot": 1,
        "gate": null
      },
      {
        "teamId": "",
        "slot": 2,
        "gate": null
      },
      {
        "teamId": "",
        "slot": 0,
        "gate": null
      },
      {
        "teamId": "",
        "slot": 1,
        "gate": null
      },
      {
        "teamId": "",
        "slot": 2,
        "gate": null
      },
      {
        "teamId": "",
        "slot": 0,
        "gate": null
      },
      {
        "teamId": "",
        "slot": 1,
        "gate": null
      },
      {
        "teamId": "",
        "slot": 2,
        "gate": null
      }
    ],
    "medium": [
      {
        "teamId": "",
        "slot": 0,
        "gate": null
      },
      {
        "teamId": "",
        "slot": 1,
        "gate": null
      },
      {
        "teamId": "",
        "slot": 2,
        "gate": null
      },
      {
        "teamId": "",
        "slot": 0,
        "gate": null
      },
      {
        "teamId": "",
        "slot": 1,
        "gate": null
      },
      {
        "teamId": "",
        "slot": 2,
        "gate": null
      },
      {
        "teamId": "",
        "slot": 0,
        "gate": null
      },
      {
        "teamId": "",
        "slot": 1,
        "gate": null
      },
      {
        "teamId": "",
        "slot": 2,
        "gate": null
      }
    ],
    "long": [
      {
        "teamId": "",
        "slot": 0,
        "gate": null
      },
      {
        "teamId": "",
        "slot": 1,
        "gate": null
      },
      {
        "teamId": "",
        "slot": 2,
        "gate": null
      },
      {
        "teamId": "",
        "slot": 0,
        "gate": null
      },
      {
        "teamId": "",
        "slot": 1,
        "gate": null
      },
      {
        "teamId": "",
        "slot": 2,
        "gate": null
      },
      {
        "teamId": "",
        "slot": 0,
        "gate": null
      },
      {
        "teamId": "",
        "slot": 1,
        "gate": null
      },
      {
        "teamId": "",
        "slot": 2,
        "gate": null
      }
    ],
    "dirt": [
      {
        "teamId": "",
        "slot": 0,
        "gate": null
      },
      {
        "teamId": "",
        "slot": 1,
        "gate": null
      },
      {
        "teamId": "",
        "slot": 2,
        "gate": null
      },
      {
        "teamId": "",
        "slot": 0,
        "gate": null
      },
      {
        "teamId": "",
        "slot": 1,
        "gate": null
      },
      {
        "teamId": "",
        "slot": 2,
        "gate": null
      },
      {
        "teamId": "",
        "slot": 0,
        "gate": null
      },
      {
        "teamId": "",
        "slot": 1,
        "gate": null
      },
      {
        "teamId": "",
        "slot": 2,
        "gate": null
      }
    ]
  }
}
