{
  "id": "day1-match01",
  "day": 1,
  "matchNumber": 1,
  "round": "Group A Match 1",
  "teams": [
    "ritto-dorm-dropouts",
    "dust-bunny",
    "umazing-hotspring"
  ],
  "activeCategory": "mile",
  "races": {
    "sprint": [
      {
        "teamId": "ritto-dorm-dropouts",
        "slot": 0,
        "gate": 8
      },
      {
        "teamId": "ritto-dorm-dropouts",
        "slot": 1,
        "gate": 5
      },
      {
        "teamId": "ritto-dorm-dropouts",
        "slot": 2,
        "gate": 1
      },
      {
        "teamId": "dust-bunny",
        "slot": 0,
        "gate": 9
      },
      {
        "teamId": "dust-bunny",
        "slot": 1,
        "gate": 7
      },
      {
        "teamId": "dust-bunny",
        "slot": 2,
        "gate": 4
      },
      {
        "teamId": "umazing-hotspring",
        "slot": 0,
        "gate": 6
      },
      {
        "teamId": "umazing-hotspring",
        "slot": 1,
        "gate": 3
      },
      {
        "teamId": "umazing-hotspring",
        "slot": 2,
        "gate": 2
      }
    ],
    "mile": [
      {
        "teamId": "ritto-dorm-dropouts",
        "slot": 0,
        "gate": null
      },
      {
        "teamId": "ritto-dorm-dropouts",
        "slot": 1,
        "gate": null
      },
      {
        "teamId": "ritto-dorm-dropouts",
        "slot": 2,
        "gate": null
      },
      {
        "teamId": "dust-bunny",
        "slot": 0,
        "gate": null
      },
      {
        "teamId": "dust-bunny",
        "slot": 1,
        "gate": null
      },
      {
        "teamId": "dust-bunny",
        "slot": 2,
        "gate": null
      },
      {
        "teamId": "umazing-hotspring",
        "slot": 0,
        "gate": null
      },
      {
        "teamId": "umazing-hotspring",
        "slot": 1,
        "gate": null
      },
      {
        "teamId": "umazing-hotspring",
        "slot": 2,
        "gate": null
      }
    ],
    "medium": [
      {
        "teamId": "ritto-dorm-dropouts",
        "slot": 0,
        "gate": null
      },
      {
        "teamId": "ritto-dorm-dropouts",
        "slot": 1,
        "gate": null
      },
      {
        "teamId": "ritto-dorm-dropouts",
        "slot": 2,
        "gate": null
      },
      {
        "teamId": "dust-bunny",
        "slot": 0,
        "gate": null
      },
      {
        "teamId": "dust-bunny",
        "slot": 1,
        "gate": null
      },
      {
        "teamId": "dust-bunny",
        "slot": 2,
        "gate": null
      },
      {
        "teamId": "umazing-hotspring",
        "slot": 0,
        "gate": null
      },
      {
        "teamId": "umazing-hotspring",
        "slot": 1,
        "gate": null
      },
      {
        "teamId": "umazing-hotspring",
        "slot": 2,
        "gate": null
      }
    ],
    "long": [
      {
        "teamId": "ritto-dorm-dropouts",
        "slot": 0,
        "gate": 6
      },
      {
        "teamId": "ritto-dorm-dropouts",
        "slot": 1,
        "gate": 8
      },
      {
        "teamId": "ritto-dorm-dropouts",
        "slot": 2,
        "gate": 4
      },
      {
        "teamId": "dust-bunny",
        "slot": 0,
        "gate": 8
      },
      {
        "teamId": "dust-bunny",
        "slot": 1,
        "gate": 3
      },
      {
        "teamId": "dust-bunny",
        "slot": 2,
        "gate": 2
      },
      {
        "teamId": "umazing-hotspring",
        "slot": 0,
        "gate": 9
      },
      {
        "teamId": "umazing-hotspring",
        "slot": 1,
        "gate": 5
      },
      {
        "teamId": "umazing-hotspring",
        "slot": 2,
        "gate": 1
      }
    ],
    "dirt": [
      {
        "teamId": "ritto-dorm-dropouts",
        "slot": 0,
        "gate": 2
      },
      {
        "teamId": "ritto-dorm-dropouts",
        "slot": 1,
        "gate": 1
      },
      {
        "teamId": "ritto-dorm-dropouts",
        "slot": 2,
        "gate": 3
      },
      {
        "teamId": "dust-bunny",
        "slot": 0,
        "gate": 5
      },
      {
        "teamId": "dust-bunny",
        "slot": 1,
        "gate": 7
      },
      {
        "teamId": "dust-bunny",
        "slot": 2,
        "gate": 9
      },
      {
        "teamId": "umazing-hotspring",
        "slot": 0,
        "gate": 6
      },
      {
        "teamId": "umazing-hotspring",
        "slot": 1,
        "gate": 8
      },
      {
        "teamId": "umazing-hotspring",
        "slot": 2,
        "gate": 4
      }
    ]
  }
}
