{
  "id": "day1-match02",
  "day": 1,
  "matchNumber": 2,
  "round": "Group A Match 2",
  "teams": [
    "falena",
    "umamusuko",
    "cabal"
  ],
  "activeCategory": "mile",
  "races": {
    "sprint": [
      {
        "teamId": "falena",
        "slot": 0,
        "gate": 2
      },
      {
        "teamId": "falena",
        "slot": 1,
        "gate": 8
      },
      {
        "teamId": "falena",
        "slot": 2,
        "gate": 5
      },
      {
        "teamId": "umamusuko",
        "slot": 0,
        "gate": 7
      },
      {
        "teamId": "umamusuko",
        "slot": 1,
        "gate": 6
      },
      {
        "teamId": "umamusuko",
        "slot": 2,
        "gate": 3
      },
      {
        "teamId": "cabal",
        "slot": 0,
        "gate": 9
      },
      {
        "teamId": "cabal",
        "slot": 1,
        "gate": 4
      },
      {
        "teamId": "cabal",
        "slot": 2,
        "gate": 1
      }
    ],
    "mile": [
      {
        "teamId": "falena",
        "slot": 0,
        "gate": 3
      },
      {
        "teamId": "falena",
        "slot": 1,
        "gate": 7
      },
      {
        "teamId": "falena",
        "slot": 2,
        "gate": 9
      },
      {
        "teamId": "umamusuko",
        "slot": 0,
        "gate": 6
      },
      {
        "teamId": "umamusuko",
        "slot": 1,
        "gate": 4
      },
      {
        "teamId": "umamusuko",
        "slot": 2,
        "gate": 5
      },
      {
        "teamId": "cabal",
        "slot": 0,
        "gate": 1
      },
      {
        "teamId": "cabal",
        "slot": 1,
        "gate": 2
      },
      {
        "teamId": "cabal",
        "slot": 2,
        "gate": 8
      }
    ],
    "medium": [
      {
        "teamId": "falena",
        "slot": 0,
        "gate": null
      },
      {
        "teamId": "falena",
        "slot": 1,
        "gate": null
      },
      {
        "teamId": "falena",
        "slot": 2,
        "gate": null
      },
      {
        "teamId": "umamusuko",
        "slot": 0,
        "gate": null
      },
      {
        "teamId": "umamusuko",
        "slot": 1,
        "gate": null
      },
      {
        "teamId": "umamusuko",
        "slot": 2,
        "gate": null
      },
      {
        "teamId": "cabal",
        "slot": 0,
        "gate": null
      },
      {
        "teamId": "cabal",
        "slot": 1,
        "gate": null
      },
      {
        "teamId": "cabal",
        "slot": 2,
        "gate": null
      }
    ],
    "long": [
      {
        "teamId": "falena",
        "slot": 0,
        "gate": null
      },
      {
        "teamId": "falena",
        "slot": 1,
        "gate": null
      },
      {
        "teamId": "falena",
        "slot": 2,
        "gate": null
      },
      {
        "teamId": "umamusuko",
        "slot": 0,
        "gate": null
      },
      {
        "teamId": "umamusuko",
        "slot": 1,
        "gate": null
      },
      {
        "teamId": "umamusuko",
        "slot": 2,
        "gate": null
      },
      {
        "teamId": "cabal",
        "slot": 0,
        "gate": null
      },
      {
        "teamId": "cabal",
        "slot": 1,
        "gate": null
      },
      {
        "teamId": "cabal",
        "slot": 2,
        "gate": null
      }
    ],
    "dirt": [
      {
        "teamId": "falena",
        "slot": 0,
        "gate": null
      },
      {
        "teamId": "falena",
        "slot": 1,
        "gate": null
      },
      {
        "teamId": "falena",
        "slot": 2,
        "gate": null
      },
      {
        "teamId": "umamusuko",
        "slot": 0,
        "gate": null
      },
      {
        "teamId": "umamusuko",
        "slot": 1,
        "gate": null
      },
      {
        "teamId": "umamusuko",
        "slot": 2,
        "gate": null
      },
      {
        "teamId": "cabal",
        "slot": 0,
        "gate": null
      },
      {
        "teamId": "cabal",
        "slot": 1,
        "gate": null
      },
      {
        "teamId": "cabal",
        "slot": 2,
        "gate": null
      }
    ]
  }
}
