{
  "id": "day1-match09",
  "day": 2,
  "matchNumber": 9,
  "round": "Group A Semi",
  "teams": [
    "dust-bunny",
    "umamusuko",
    "umazing-hotspring"
  ],
  "activeCategory": "dirt",
  "races": {
    "sprint": [
      {
        "teamId": "dust-bunny",
        "slot": 0,
        "gate": 7
      },
      {
        "teamId": "dust-bunny",
        "slot": 1,
        "gate": 8
      },
      {
        "teamId": "dust-bunny",
        "slot": 2,
        "gate": 6
      },
      {
        "teamId": "umamusuko",
        "slot": 0,
        "gate": 9
      },
      {
        "teamId": "umamusuko",
        "slot": 1,
        "gate": 5
      },
      {
        "teamId": "umamusuko",
        "slot": 2,
        "gate": 2
      },
      {
        "teamId": "umazing-hotspring",
        "slot": 0,
        "gate": 1
      },
      {
        "teamId": "umazing-hotspring",
        "slot": 1,
        "gate": 3
      },
      {
        "teamId": "umazing-hotspring",
        "slot": 2,
        "gate": 4
      }
    ],
    "mile": [
      {
        "teamId": "dust-bunny",
        "slot": 0,
        "gate": 9
      },
      {
        "teamId": "dust-bunny",
        "slot": 1,
        "gate": 2
      },
      {
        "teamId": "dust-bunny",
        "slot": 2,
        "gate": 6
      },
      {
        "teamId": "umamusuko",
        "slot": 0,
        "gate": 4
      },
      {
        "teamId": "umamusuko",
        "slot": 1,
        "gate": 3
      },
      {
        "teamId": "umamusuko",
        "slot": 2,
        "gate": 8
      },
      {
        "teamId": "umazing-hotspring",
        "slot": 0,
        "gate": 7
      },
      {
        "teamId": "umazing-hotspring",
        "slot": 1,
        "gate": 5
      },
      {
        "teamId": "umazing-hotspring",
        "slot": 2,
        "gate": 1
      }
    ],
    "medium": [
      {
        "teamId": "dust-bunny",
        "slot": 0,
        "gate": 2
      },
      {
        "teamId": "dust-bunny",
        "slot": 1,
        "gate": 6
      },
      {
        "teamId": "dust-bunny",
        "slot": 2,
        "gate": 7
      },
      {
        "teamId": "umamusuko",
        "slot": 0,
        "gate": 4
      },
      {
        "teamId": "umamusuko",
        "slot": 1,
        "gate": 1
      },
      {
        "teamId": "umamusuko",
        "slot": 2,
        "gate": 9
      },
      {
        "teamId": "umazing-hotspring",
        "slot": 0,
        "gate": 3
      },
      {
        "teamId": "umazing-hotspring",
        "slot": 1,
        "gate": 8
      },
      {
        "teamId": "umazing-hotspring",
        "slot": 2,
        "gate": 5
      }
    ],
    "long": [
      {
        "teamId": "dust-bunny",
        "slot": 0,
        "gate": 3
      },
      {
        "teamId": "dust-bunny",
        "slot": 1,
        "gate": 7
      },
      {
        "teamId": "dust-bunny",
        "slot": 2,
        "gate": 1
      },
      {
        "teamId": "umamusuko",
        "slot": 0,
        "gate": 6
      },
      {
        "teamId": "umamusuko",
        "slot": 1,
        "gate": 9
      },
      {
        "teamId": "umamusuko",
        "slot": 2,
        "gate": 8
      },
      {
        "teamId": "umazing-hotspring",
        "slot": 0,
        "gate": 2
      },
      {
        "teamId": "umazing-hotspring",
        "slot": 1,
        "gate": 5
      },
      {
        "teamId": "umazing-hotspring",
        "slot": 2,
        "gate": 4
      }
    ],
    "dirt": [
      {
        "teamId": "dust-bunny",
        "slot": 0,
        "gate": null
      },
      {
        "teamId": "dust-bunny",
        "slot": 1,
        "gate": null
      },
      {
        "teamId": "dust-bunny",
        "slot": 2,
        "gate": null
      },
      {
        "teamId": "umamusuko",
        "slot": 0,
        "gate": null
      },
      {
        "teamId": "umamusuko",
        "slot": 1,
        "gate": null
      },
      {
        "teamId": "umamusuko",
        "slot": 2,
        "gate": null
      },
      {
        "teamId": "umazing-hotspring",
        "slot": 0,
        "gate": null
      },
      {
        "teamId": "umazing-hotspring",
        "slot": 1,
        "gate": null
      },
      {
        "teamId": "umazing-hotspring",
        "slot": 2,
        "gate": null
      }
    ]
  }
}
