{
  "id": "day1-match03",
  "day": 1,
  "matchNumber": 3,
  "round": "Group B Match 1",
  "teams": [
    "the-shadow-clones",
    "umalliance",
    "king"
  ],
  "activeCategory": "sprint",
  "races": {
    "sprint": [
      {
        "teamId": "the-shadow-clones",
        "slot": 0,
        "gate": null
      },
      {
        "teamId": "the-shadow-clones",
        "slot": 1,
        "gate": null
      },
      {
        "teamId": "the-shadow-clones",
        "slot": 2,
        "gate": null
      },
      {
        "teamId": "umalliance",
        "slot": 0,
        "gate": null
      },
      {
        "teamId": "umalliance",
        "slot": 1,
        "gate": null
      },
      {
        "teamId": "umalliance",
        "slot": 2,
        "gate": null
      },
      {
        "teamId": "king",
        "slot": 0,
        "gate": null
      },
      {
        "teamId": "king",
        "slot": 1,
        "gate": null
      },
      {
        "teamId": "king",
        "slot": 2,
        "gate": null
      }
    ],
    "mile": [
      {
        "teamId": "the-shadow-clones",
        "slot": 0,
        "gate": null
      },
      {
        "teamId": "the-shadow-clones",
        "slot": 1,
        "gate": null
      },
      {
        "teamId": "the-shadow-clones",
        "slot": 2,
        "gate": null
      },
      {
        "teamId": "umalliance",
        "slot": 0,
        "gate": null
      },
      {
        "teamId": "umalliance",
        "slot": 1,
        "gate": null
      },
      {
        "teamId": "umalliance",
        "slot": 2,
        "gate": null
      },
      {
        "teamId": "king",
        "slot": 0,
        "gate": null
      },
      {
        "teamId": "king",
        "slot": 1,
        "gate": null
      },
      {
        "teamId": "king",
        "slot": 2,
        "gate": null
      }
    ],
    "medium": [
      {
        "teamId": "the-shadow-clones",
        "slot": 0,
        "gate": null
      },
      {
        "teamId": "the-shadow-clones",
        "slot": 1,
        "gate": null
      },
      {
        "teamId": "the-shadow-clones",
        "slot": 2,
        "gate": null
      },
      {
        "teamId": "umalliance",
        "slot": 0,
        "gate": null
      },
      {
        "teamId": "umalliance",
        "slot": 1,
        "gate": null
      },
      {
        "teamId": "umalliance",
        "slot": 2,
        "gate": null
      },
      {
        "teamId": "king",
        "slot": 0,
        "gate": null
      },
      {
        "teamId": "king",
        "slot": 1,
        "gate": null
      },
      {
        "teamId": "king",
        "slot": 2,
        "gate": null
      }
    ],
    "long": [
      {
        "teamId": "the-shadow-clones",
        "slot": 0,
        "gate": null
      },
      {
        "teamId": "the-shadow-clones",
        "slot": 1,
        "gate": null
      },
      {
        "teamId": "the-shadow-clones",
        "slot": 2,
        "gate": null
      },
      {
        "teamId": "umalliance",
        "slot": 0,
        "gate": null
      },
      {
        "teamId": "umalliance",
        "slot": 1,
        "gate": null
      },
      {
        "teamId": "umalliance",
        "slot": 2,
        "gate": null
      },
      {
        "teamId": "king",
        "slot": 0,
        "gate": null
      },
      {
        "teamId": "king",
        "slot": 1,
        "gate": null
      },
      {
        "teamId": "king",
        "slot": 2,
        "gate": null
      }
    ],
    "dirt": [
      {
        "teamId": "the-shadow-clones",
        "slot": 0,
        "gate": null
      },
      {
        "teamId": "the-shadow-clones",
        "slot": 1,
        "gate": null
      },
      {
        "teamId": "the-shadow-clones",
        "slot": 2,
        "gate": null
      },
      {
        "teamId": "umalliance",
        "slot": 0,
        "gate": null
      },
      {
        "teamId": "umalliance",
        "slot": 1,
        "gate": null
      },
      {
        "teamId": "umalliance",
        "slot": 2,
        "gate": null
      },
      {
        "teamId": "king",
        "slot": 0,
        "gate": null
      },
      {
        "teamId": "king",
        "slot": 1,
        "gate": null
      },
      {
        "teamId": "king",
        "slot": 2,
        "gate": null
      }
    ]
  }
}
