{
  "id": "day1-match05",
  "day": 1,
  "matchNumber": 5,
  "round": "Group A Match 3 (MIDDLE)",
  "teams": [
    "ritto-dorm-dropouts",
    "cabal",
    ""
  ],
  "activeCategory": "mile",
  "races": {
    "sprint": [
      {
        "teamId": "ritto-dorm-dropouts",
        "slot": 0,
        "gate": 9
      },
      {
        "teamId": "ritto-dorm-dropouts",
        "slot": 1,
        "gate": 4
      },
      {
        "teamId": "ritto-dorm-dropouts",
        "slot": 2,
        "gate": 6
      },
      {
        "teamId": "cabal",
        "slot": 0,
        "gate": 1
      },
      {
        "teamId": "cabal",
        "slot": 1,
        "gate": 5
      },
      {
        "teamId": "cabal",
        "slot": 2,
        "gate": 2
      },
      {
        "teamId": "",
        "slot": 0,
        "gate": null
      },
      {
        "teamId": "",
        "slot": 1,
        "gate": null
      },
      {
        "teamId": "",
        "slot": 2,
        "gate": null
      }
    ],
    "mile": [
      {
        "teamId": "ritto-dorm-dropouts",
        "slot": 0,
        "gate": 3
      },
      {
        "teamId": "ritto-dorm-dropouts",
        "slot": 1,
        "gate": 5
      },
      {
        "teamId": "ritto-dorm-dropouts",
        "slot": 2,
        "gate": 2
      },
      {
        "teamId": "cabal",
        "slot": 0,
        "gate": 4
      },
      {
        "teamId": "cabal",
        "slot": 1,
        "gate": 6
      },
      {
        "teamId": "cabal",
        "slot": 2,
        "gate": 9
      },
      {
        "teamId": "",
        "slot": 0,
        "gate": null
      },
      {
        "teamId": "",
        "slot": 1,
        "gate": null
      },
      {
        "teamId": "",
        "slot": 2,
        "gate": null
      }
    ],
    "medium": [
      {
        "teamId": "ritto-dorm-dropouts",
        "slot": 0,
        "gate": null
      },
      {
        "teamId": "ritto-dorm-dropouts",
        "slot": 1,
        "gate": null
      },
      {
        "teamId": "ritto-dorm-dropouts",
        "slot": 2,
        "gate": null
      },
      {
        "teamId": "cabal",
        "slot": 0,
        "gate": null
      },
      {
        "teamId": "cabal",
        "slot": 1,
        "gate": null
      },
      {
        "teamId": "cabal",
        "slot": 2,
        "gate": null
      },
      {
        "teamId": "",
        "slot": 0,
        "gate": null
      },
      {
        "teamId": "",
        "slot": 1,
        "gate": null
      },
      {
        "teamId": "",
        "slot": 2,
        "gate": null
      }
    ],
    "long": [
      {
        "teamId": "ritto-dorm-dropouts",
        "slot": 0,
        "gate": null
      },
      {
        "teamId": "ritto-dorm-dropouts",
        "slot": 1,
        "gate": null
      },
      {
        "teamId": "ritto-dorm-dropouts",
        "slot": 2,
        "gate": null
      },
      {
        "teamId": "cabal",
        "slot": 0,
        "gate": null
      },
      {
        "teamId": "cabal",
        "slot": 1,
        "gate": null
      },
      {
        "teamId": "cabal",
        "slot": 2,
        "gate": null
      },
      {
        "teamId": "",
        "slot": 0,
        "gate": null
      },
      {
        "teamId": "",
        "slot": 1,
        "gate": null
      },
      {
        "teamId": "",
        "slot": 2,
        "gate": null
      }
    ],
    "dirt": [
      {
        "teamId": "ritto-dorm-dropouts",
        "slot": 0,
        "gate": null
      },
      {
        "teamId": "ritto-dorm-dropouts",
        "slot": 1,
        "gate": null
      },
      {
        "teamId": "ritto-dorm-dropouts",
        "slot": 2,
        "gate": null
      },
      {
        "teamId": "cabal",
        "slot": 0,
        "gate": null
      },
      {
        "teamId": "cabal",
        "slot": 1,
        "gate": null
      },
      {
        "teamId": "cabal",
        "slot": 2,
        "gate": null
      },
      {
        "teamId": "",
        "slot": 0,
        "gate": null
      },
      {
        "teamId": "",
        "slot": 1,
        "gate": null
      },
      {
        "teamId": "",
        "slot": 2,
        "gate": null
      }
    ]
  }
}
